<?xml version="1.0" encoding="UTF-8"?>
<?xml-stylesheet type="text/xsl" href="catalogo.xsl"?>
<!DOCTYPE catalogo SYSTEM "datos.dtd">
<catalogo>

  <juego id="j1">
    <titulo>Nébula Rift</titulo>
    <desarrollador>Estudio Cronos</desarrollador>
    <anio>2024</anio>
    <genero>Shooter espacial</genero>
    <plataforma>PC / PS5</plataforma>
    <precio>39.99</precio>
    <calificacion>4.6</calificacion>
    <descripcion>Combate por control de sectores estelares con naves modulares y cooperativo para 3 jugadores.</descripcion>
  </juego>

  <juego id="j2">
    <titulo>Sombra de Quisqueya</titulo>
    <desarrollador>Pixel Boricua</desarrollador>
    <anio>2023</anio>
    <genero>Aventura narrativa</genero>
    <plataforma>Switch / PC</plataforma>
    <precio>24.99</precio>
    <calificacion>4.8</calificacion>
    <descripcion>Un explorador recorre pueblos inspirados en el Caribe resolviendo acertijos con instrumentos tradicionales.</descripcion>
  </juego>

  <juego id="j3">
    <titulo>Forja de Hierro</titulo>
    <desarrollador>Yunque Digital</desarrollador>
    <anio>2022</anio>
    <genero>Estrategia por turnos</genero>
    <plataforma>PC</plataforma>
    <precio>29.99</precio>
    <calificacion>4.3</calificacion>
    <descripcion>Construye un reino industrial y gestiona rutas comerciales frente a facciones rivales.</descripcion>
  </juego>

  <juego id="j4">
    <titulo>Carrera Neón</titulo>
    <desarrollador>Voltio Games</desarrollador>
    <anio>2025</anio>
    <genero>Carreras arcade</genero>
    <plataforma>PS5 / Xbox Series</plataforma>
    <precio>34.99</precio>
    <calificacion>4.1</calificacion>
    <descripcion>Circuitos urbanos nocturnos con física arcade y personalización total de vehículos.</descripcion>
  </juego>

  <juego id="j5">
    <titulo>Reino de Cristal</titulo>
    <desarrollador>Estudio Cronos</desarrollador>
    <anio>2021</anio>
    <genero>RPG táctico</genero>
    <plataforma>Switch</plataforma>
    <precio>19.99</precio>
    <calificacion>4.7</calificacion>
    <descripcion>Escuadrones de héroes elementales luchan por restaurar un reino fracturado en tableros hexagonales.</descripcion>
  </juego>

  <juego id="j6">
    <titulo>Abismo 7</titulo>
    <desarrollador>Kraken Interactive</desarrollador>
    <anio>2024</anio>
    <genero>Survival horror</genero>
    <plataforma>PC / PS5</plataforma>
    <precio>44.99</precio>
    <calificacion>4.4</calificacion>
    <descripcion>Una estación submarina abandonada esconde criaturas que reaccionan al sonido de tus pasos.</descripcion>
  </juego>

  <juego id="j7">
    <titulo>Bloque a Bloque</titulo>
    <desarrollador>Cubo Estudio</desarrollador>
    <anio>2020</anio>
    <genero>Puzle</genero>
    <plataforma>Móvil / PC</plataforma>
    <precio>4.99</precio>
    <calificacion>4.5</calificacion>
    <descripcion>Cientos de niveles de lógica espacial con mecánicas de gravedad que se reinventan cada mundo.</descripcion>
  </juego>

  <juego id="j8">
    <titulo>Liga Popular</titulo>
    <desarrollador>Cancha Estudios</desarrollador>
    <anio>2025</anio>
    <genero>Deportes</genero>
    <plataforma>PS5 / Xbox Series / PC</plataforma>
    <precio>49.99</precio>
    <calificacion>4.0</calificacion>
    <descripcion>Simulador de baloncesto de calle con ligas barriales y modo carrera de jugador.</descripcion>
  </juego>

</catalogo>
